{
  "schemaVersion": 1,
  "asOf": "2026-08-26",
  "status": "foundation_gated",
  "currentStageId": "LS-001",
  "authority": {
    "launchAuthorized": false,
    "deploymentAuthorized": false,
    "publicationAuthorized": false,
    "outreachAuthorized": false,
    "researchRecruitmentAuthorized": false,
    "dataCollectionAuthorized": false,
    "searchSubmissionAuthorized": false,
    "portalSubmissionAuthorized": false,
    "paidAcquisitionAuthorized": false,
    "monetizationExecutionAuthorized": false,
    "behavioralTargetingOfMinorsPermitted": false,
    "agentMayTreatConversationAsAuthorization": false
  },
  "principles": {
    "primaryOutcome": "meaningful_play_trust_and_durable_learning",
    "initialDiscoveryAudience": "adults_guardians_and_general_creature_game_audiences",
    "minorDirectOutreachPermitted": false,
    "simulatedAudienceEvidencePermitted": false,
    "vanityMetricsMayAuthorizeScale": false,
    "laterStageMayBypassEarlierRequiredStage": false
  },
  "tracks": [
    {
      "id": "LT-001",
      "name": "Trust governance and safeguarding",
      "status": "blocked",
      "ready": false,
      "owner": "Safeguarding owner unassigned",
      "workflowRefs": ["A-004", "A-011", "A-025", "A-035", "A-036"],
      "decisionRefs": ["D-012", "D-014"],
      "riskRefs": ["R-001", "R-011"],
      "proofIds": [],
      "channelIds": [],
      "experimentRefs": ["E-003"],
      "opportunityRefs": [],
      "handoffRefs": ["GDH-003", "GDH-006"],
      "blockers": [
        "Safeguarding primary, backup, urgent route, geography, and coverage are unassigned.",
        "Trusted approval verification and specialist privacy/legal boundaries are not operational."
      ],
      "exitEvidence": "Named and tested safeguarding route, reviewed trust boundaries, and scoped approval control."
    },
    {
      "id": "LT-002",
      "name": "Product and release",
      "status": "partially_ready",
      "ready": false,
      "owner": "Game Development release owner unassigned",
      "workflowRefs": ["A-001", "A-018"],
      "decisionRefs": ["D-015"],
      "riskRefs": ["R-002"],
      "proofIds": [],
      "channelIds": ["CH-001"],
      "experimentRefs": ["E-001"],
      "opportunityRefs": [],
      "handoffRefs": ["GDH-001", "GDH-003"],
      "blockers": [
        "The public website and game route are live, but the continuing game release still needs a named release and rollback owner.",
        "A stable public build is observable; broader launch changes still need build naming, rollback evidence and post-release checks."
      ],
      "exitEvidence": "Approved isolated release, verified rollback, clean post-release checks, and stable named build."
    },
    {
      "id": "LT-003",
      "name": "Audience and positioning",
      "status": "blocked",
      "ready": false,
      "owner": "Research owner unassigned",
      "workflowRefs": ["A-005", "A-019", "A-029"],
      "decisionRefs": ["D-002"],
      "riskRefs": ["R-003"],
      "proofIds": [],
      "channelIds": [],
      "experimentRefs": ["E-002", "E-003"],
      "opportunityRefs": [],
      "handoffRefs": [],
      "blockers": [
        "No adult research owner, approved recruitment route, or accepted customer evidence exists.",
        "Child/family-led versus broader creature/narrative-led launch positioning is unresolved."
      ],
      "exitEvidence": "Accepted de-identified evidence establishes comprehension, trust concerns, audience choice, uncertainty, and disconfirming signals."
    },
    {
      "id": "LT-004",
      "name": "Proof and creative",
      "status": "partially_ready",
      "ready": false,
      "owner": "Game Development proof owner unassigned",
      "workflowRefs": ["A-003", "A-013", "A-027", "A-034"],
      "decisionRefs": ["D-011"],
      "riskRefs": ["R-004"],
      "proofIds": ["PF-003", "PF-004", "PF-005"],
      "channelIds": ["CH-001", "CH-002"],
      "experimentRefs": ["E-002"],
      "opportunityRefs": [],
      "handoffRefs": ["GDH-004"],
      "blockers": [
        "A real gameplay gallery and a short real gameplay video now exist with source-build and privacy records.",
        "The stricter hatch-to-bond, before-and-after restoration and Project Beacon choice sequences are still missing."
      ],
      "exitEvidence": "Three authentic, build-linked, rights-cleared, accessible proof assets approved for their exact claims and audiences."
    },
    {
      "id": "LT-005",
      "name": "Owned discovery and channels",
      "status": "partially_ready",
      "ready": false,
      "owner": "Search and channel owners unassigned",
      "workflowRefs": ["A-008", "A-013", "A-018", "A-021", "A-033", "A-034", "A-035"],
      "decisionRefs": ["D-011", "D-015"],
      "riskRefs": ["R-005"],
      "proofIds": ["PF-003", "PF-004"],
      "channelIds": ["CH-001", "CH-002", "CH-003", "CH-004", "CH-005"],
      "experimentRefs": ["E-001"],
      "opportunityRefs": [],
      "handoffRefs": ["GDH-001", "GDH-004"],
      "blockers": [
        "The homepage, creature genetics, NASA and STEM, parents, studio and press pages are live and were checked on 2026-08-14.",
        "Official social accounts do not exist yet; search-console access, trusted reporting, moderation ownership and publication access remain incomplete."
      ],
      "exitEvidence": "Verified owned discovery, approved canonical pages, named channel owners, moderation, measurement, and exact publication controls."
    },
    {
      "id": "LT-006",
      "name": "Distribution and partnerships",
      "status": "partially_ready",
      "ready": false,
      "owner": "Distribution owner unassigned",
      "workflowRefs": ["A-007", "A-011", "A-032", "A-035"],
      "decisionRefs": ["D-005", "D-014"],
      "riskRefs": ["R-007"],
      "proofIds": ["PF-003", "PF-004", "PF-005"],
      "channelIds": [],
      "experimentRefs": [],
      "opportunityRefs": ["OP-001", "OP-002", "OP-003", "OP-004"],
      "handoffRefs": ["GDH-005"],
      "blockers": [
        "A portable browser build, itch.io package, launch copy, cover and ranked platform plan are prepared and locally tested.",
        "No itch.io account or private page exists; target-platform touch, fullscreen, terms, screenshot review and Kevin's publication decision remain open."
      ],
      "exitEvidence": "One evidence-ranked route with portable-build, rights, privacy, economics, integration, support, and scoped approval evidence."
    },
    {
      "id": "LT-007",
      "name": "Engagement and support",
      "status": "blocked",
      "ready": false,
      "owner": "Support and lifecycle owners unassigned",
      "workflowRefs": ["A-004", "A-020", "A-035"],
      "decisionRefs": ["D-006", "D-012", "D-014"],
      "riskRefs": ["R-001", "R-009", "R-011"],
      "proofIds": [],
      "channelIds": ["CH-007"],
      "experimentRefs": ["E-003"],
      "opportunityRefs": [],
      "handoffRefs": [],
      "blockers": [
        "Support and safeguarding owners, urgent route, inbox boundary, consent, suppression, retention, and send policy are incomplete.",
        "All six lifecycle programs remain designed and gated with zero contact records."
      ],
      "exitEvidence": "Named service owners, tested restricted-case escalation, approved knowledge, adult consent/suppression where required, and bounded human-send policy."
    },
    {
      "id": "LT-008",
      "name": "Measurement and finance",
      "status": "blocked",
      "ready": false,
      "owner": "Measurement and finance owners unassigned",
      "workflowRefs": ["A-006", "A-022", "A-035"],
      "decisionRefs": ["D-003", "D-004", "D-016"],
      "riskRefs": ["R-012"],
      "proofIds": [],
      "channelIds": [],
      "experimentRefs": ["E-004"],
      "opportunityRefs": [],
      "handoffRefs": ["GDH-002"],
      "blockers": [
        "The public website has a consent-gated Google tag and a source-verified five-action boundary; the stricter no-request-before-consent upgrade is prepared but not yet released.",
        "Google property ownership, retention, report access, live event receipt and the weekly review owner are not yet verified, so no analytics number is trusted for company reporting.",
        "Entity, currency, cash, commitments, actuals, costs, runway, and unit economics have no verified restricted source."
      ],
      "exitEvidence": "Approved minimal measurement plus reconciled restricted financial baseline, unit costs, caps, stop rules, and runway method."
    }
  ],
  "stages": [
    {
      "id": "LS-001",
      "order": 1,
      "name": "Quiet owned access",
      "state": "active_constrained",
      "ready": true,
      "authorized": false,
      "requiredTrackIds": [],
      "requiredPriorStageIds": [],
      "decisionRefs": [],
      "riskRefs": [],
      "proofIds": [],
      "channelIds": ["CH-001"],
      "experimentRefs": [],
      "opportunityRefs": [],
      "handoffRefs": [],
      "workflowRefs": ["A-001"],
      "blockers": ["Existing access is not a launch authorization, evidence of demand, or permission to promote."],
      "successEvidence": "Production access remains observable and constraints are reported without promotion or market claims."
    },
    {
      "id": "LS-002",
      "order": 2,
      "name": "Controlled adult research",
      "state": "gated",
      "ready": false,
      "authorized": false,
      "requiredTrackIds": ["LT-001", "LT-003", "LT-007"],
      "requiredPriorStageIds": ["LS-001"],
      "decisionRefs": ["D-002", "D-012"],
      "riskRefs": ["R-001", "R-003"],
      "proofIds": [],
      "channelIds": [],
      "experimentRefs": ["E-002", "E-003"],
      "opportunityRefs": [],
      "handoffRefs": [],
      "workflowRefs": ["A-005", "A-019", "A-020"],
      "blockers": ["Safeguarding, research ownership, audience decision, recruitment, and evidence-handling gates are unresolved."],